{
  "schemaVersion": "1.0.0",
  "product": "DWG Translator",
  "sourceRevision": "aaaaaaaaaaaaaaaaaaaaaaaaaaaaaaaaaaaaaaaa",
  "producedAtUtc": "2026-08-14T00:00:00Z",
  "expiresAtUtc": "2026-08-15T00:00:00Z",
  "environment": "disposable-clean-windows",
  "requiresElevation": true,
  "requiredAutoCadProcessCount": 0,
  "publisherThumbprint": "2222222222222222222222222222222222222222",
  "baseline": { "fileName": "baseline.msi", "size": 8, "sha256": "aaaaaaaaaaaaaaaaaaaaaaaaaaaaaaaaaaaaaaaaaaaaaaaaaaaaaaaaaaaaaaaa", "productVersion": "0.1.0", "productCode": "{11111111-1111-1111-1111-111111111111}", "sourceRevision": "bbbbbbbbbbbbbbbbbbbbbbbbbbbbbbbbbbbbbbbb" },
  "candidate": { "fileName": "candidate.msi", "size": 9, "sha256": "cccccccccccccccccccccccccccccccccccccccccccccccccccccccccccccccc", "productVersion": "0.2.0", "productCode": "{22222222-2222-2222-2222-222222222222}", "sourceRevision": "aaaaaaaaaaaaaaaaaaaaaaaaaaaaaaaaaaaaaaaa" },
  "steps": ["assert-clean-machine", "install-baseline", "repair-baseline", "upgrade-candidate", "cancel-candidate-and-verify-windows-installer-rollback", "uninstall-candidate", "assert-clean-machine-restored"]
}
